<?xml version="1.0" encoding="UTF-8"?>
<xs:schema xmlns:xs="http://www.w3.org/2001/XMLSchema"
	elementFormDefault="qualified">

	<!-- Insert your type declarations here -->

	<!-- Insert your element declarations here -->

	<xs:element name="root">
		<xs:complexType>
			<xs:sequence>
				<xs:element name="hotels">
					<xs:complexType>
						<xs:sequence>
							<xs:element name="hotel" maxOccurs="unbounded">
								<xs:complexType>
									<xs:sequence>
										<xs:element name="city" type="xs:string" />
										<xs:element name="country" type="xs:string" />
										<xs:element name="id" type="xs:positiveInteger" />
										<xs:element name="name" type="xs:string" />
									</xs:sequence>
								</xs:complexType>
							</xs:element>
						</xs:sequence>
					</xs:complexType>
				</xs:element>
			</xs:sequence>
		</xs:complexType>
	</xs:element>
</xs:schema>
